product_id,product_title,rating,review_text,reviewer_name,date
9283655041240,The Complete Snowboard,2,"La tavola è arrivata con un graffio profondo sul bordo sinistro. Imballaggio pessimo, solo un foglio di plastica sottile. Deluso dall'acquisto.",Marco Bianchi,2026-01-15
9283655041240,The Complete Snowboard,3,"Qualità nella media, niente di eccezionale. Il prezzo è alto per quello che offre. Mi aspettavo materiali migliori per questa fascia di prezzo.",Giulia Rossi,2026-01-18
9283655041240,The Complete Snowboard,1,"Accessori mancanti! Nella confezione non c'erano i bindingscrew inclusi nella descrizione. Ho dovuto contattare il supporto tre volte prima di ricevere risposta.",Luca Ferrari,2026-01-22
9283655041240,The Complete Snowboard,4,"Buona tavola nel complesso ma la spedizione ha impiegato 3 settimane. Nessuna comunicazione sui ritardi. Il prodotto però è solido.",Anna Conti,2026-02-01
9283655041240,The Complete Snowboard,2,"Il servizio clienti è stato inutile. Ho segnalato un difetto sulla superficie e mi hanno risposto dopo 10 giorni dicendo che era normale. Non è normale.",Roberto Marino,2026-02-05
9283654910168,The Collection Snowboard: Hydrogen,3,"Tavola discreta ma la durata nel tempo mi preoccupa. Dopo sole 5 uscite si vedono già segni di usura sulla coda. Per il prezzo mi aspettavo di più.",Sara Lombardi,2026-01-10
9283654910168,The Collection Snowboard: Hydrogen,2,"Imballaggio completamente inadeguato. La scatola era ammaccata e la tavola aveva un piccolo danno sul nose. Resi e cambi complicatissimi.",Paolo Greco,2026-01-14
9283654910168,The Collection Snowboard: Hydrogen,1,"Prodotto non utilizzabile. Le viti dei binding non entrano nei fori perché sono leggermente fuori allineamento. Difetto di fabbrica evidente.",Chiara Esposito,2026-01-20
9283654910168,The Collection Snowboard: Hydrogen,4,"Nel complesso soddisfatto ma il valore non giustifica il prezzo. Ho visto tavole simili a 80€ in meno con la stessa qualità costruttiva.",Matteo Romano,2026-02-03
9283655270616,The Collection Snowboard: Liquid,2,"Spedizione lentissima e nessun tracking. Dopo 2 settimane ho dovuto chiamare io per sapere dove fosse il mio ordine. Esperienza frustrante.",Valentina Ricci,2026-01-08
9283655270616,The Collection Snowboard: Liquid,3,"La tavola scivola bene sulla neve fresca ma sulla neve dura perde molto grip. Usabilità limitata a certi contesti. Poteva essere specificato meglio.",Davide Moretti,2026-01-25
9283655270616,The Collection Snowboard: Liquid,1,"Mancano le istruzioni di montaggio e le viti di ricambio che erano elencate come incluse. Ho dovuto comprare tutto separatamente. Inaccettabile.",Elena Fontana,2026-02-08
9283655237848,The Collection Snowboard: Oxygen,4,"Buona qualità costruttiva ma la custodia protettiva inclusa si è rotta dopo il primo utilizzo. Materiale scadente per un accessorio che dovrebbe proteggere.",Simone De Luca,2026-01-12
9283655237848,The Collection Snowboard: Oxygen,2,"Ho ricevuto la tavola sbagliata. Ho ordinato la misura 158 e mi è arrivata la 154. Il reso è stato gestito malissimo dal servizio clienti.",Federica Gallo,2026-01-30
9283655237848,The Collection Snowboard: Oxygen,3,"Qualità accettabile ma non eccellente. Il grafico si è già leggermente sbiadito dopo poche uscite. Mi aspettavo maggiore resistenza per questo prezzo.",Alessandro Bruno,2026-02-10
9283654975704,Selling Plans Ski Wax,2,"La cera si applica male e non dura. Dopo una mezza giornata sulle piste la tavola perde scorrevolezza. Prodotto deludente rispetto alla descrizione.",Martina Serra,2026-01-05
9283654975704,Selling Plans Ski Wax,1,"Prodotto arrivato aperto e parzialmente usato. Imballaggio sigillato male. Impossibile capire se sia nuovo o reso. Chiederò rimborso.",Francesco Mancini,2026-01-18
9283654975704,Selling Plans Ski Wax,3,"Funziona discretamente su neve fresca ma è completamente inutile su neve artificiale. Limitazione non indicata nella descrizione del prodotto.",Silvia Costa,2026-02-02
9283655172312,The Multi-managed Snowboard,4,"Tavola tecnicamente valida ma la spedizione è arrivata in ritardo di 12 giorni rispetto alla data stimata. Zero comunicazione proattiva dal venditore.",Nicola Russo,2026-01-16
9283655172312,The Multi-managed Snowboard,2,"Il supporto clienti non risponde alle email. Ho inviato 4 messaggi in 2 settimane e non ho ricevuto alcuna risposta. Problema ancora irrisolto.",Carmen Vitale,2026-01-28
9283655139544,The Multi-location Snowboard,3,"Costruzione solida ma l'usabilità lascia a desiderare per i principianti. Troppo rigida per chi inizia, andava specificato che è una tavola avanzata.",Giorgio Pellegrini,2026-02-06
9283655139544,The Multi-location Snowboard,1,"Difetto strutturale grave: la laminazione si sta staccando sul bordo dopo sole 3 uscite. Durabilità pessima per un prodotto a questo prezzo.",Isabella Caruso,2026-02-12
9283655074008,The Videographer Snowboard,4,"Buona tavola per riprese ma il valore non è all'altezza del prezzo. Si trovano alternative valide a meno. Packaging curato almeno.",Emanuele Ferrara,2026-01-22
9283655074008,The Videographer Snowboard,2,"Accessori per il montaggio della action cam non inclusi nonostante la descrizione li menzioni esplicitamente. Pubblicità ingannevole.",Rossella Montanari,2026-02-01
9283654811864,The Minimal Snowboard,3,"Design essenziale apprezzabile ma la qualità dei materiali è nella media bassa. Per il prezzo minimal mi aspettavo almeno una finitura migliore.",Lorenzo Marini,2026-01-19
9283654811864,The Minimal Snowboard,2,"Spedizione con corriere pessimo. Pacco lasciato fuori dalla porta in piena pioggia senza suonare. Tavola fortunatamente intatta ma imballaggio distrutto.",Paola Amato,2026-02-04
9283654779096,The Inventory Not Tracked Snowboard,4,"Prodotto nella norma ma il servizio post-vendita è deludente. Ho chiesto informazioni sulla garanzia e non ho ancora ricevuto risposta dopo 3 settimane.",Massimo Leone,2026-01-11
9283654779096,The Inventory Not Tracked Snowboard,1,"Tavola completamente diversa dalle foto. Colori sbiaditi e grafica approssimativa. Sembra un prodotto di qualità inferiore rispetto a quanto pubblicizzato.",Giovanna Rizzo,2026-01-24
9283655008472,The Hidden Snowboard,3,"Tavola con buon potenziale ma manca di grip sui bordi in condizioni di ghiaccio. Problema di usabilità significativo per chi scia su piste battute.",Stefano Conti,2026-02-07
9283655008472,The Hidden Snowboard,2,"Secondo acquisto da questo store e seconda delusione. I tempi di spedizione sono sempre biblici e la comunicazione inesistente. Non tornerò.",Monica Ferretti,2026-02-14
